President,avg_AoA,biggest_words,biggest_words_definitions,smallest_words,smallest_words_definitions,biggest_sentence,biggest_sentence_rating,biggest_sentence_before,biggest_sentence_after,smallest_sentence,smallest_sentence_rating,smallest_sentence_before,smallest_sentence_after
Franklin D. Roosevelt,7.410962452007550,"['remunerative', 'guarantor', 'preferment', 'adjudication', 'necessitous']","['for which money is paid', 'one who provides a warrant or guarantee to another', 'the act of preferring', 'the final judgment in a legal proceeding; the act of pronouncing judgment based on the evidence presented', 'poor enough to need help from others']","['water', 'shoe', 'count', 'happy', 'hand']","['binary compound that occurs at room temperature as a clear colorless odorless tasteless liquid; freezes into ice below 0 degrees centigrade and boils above 100 degrees centigrade; widely used as a solvent', 'footwear shaped to fit the foot (below the ankle) with a flexible upper of leather or plastic and a sole and heel of heavier material', 'the total number counted', 'enjoying or showing or marked by joy or pleasure', 'the (prehensile) extremity of the superior limb']","We would save useful mechanical invention, machine
production, industrial efficiency, modern means of communication, broad
education.",8.013076923076920,"The vicious and wasteful parts
of that society we could not save if we wished; they have chosen the way of
self-destruction.","We would save and encourage the slowly growing impulse among
consumers to enter the industrial market place equipped with sufficient
organization to insist upon fair prices and honest sales.","And today's best is not good enough for
tomorrow.",3.55,"Actual experience is improving and speeding up our methods of
production with every passing day.",I am not satisfied with the progress thus far made.
John F. Kennedy,7.615822376581490,"['bipartisan', 'diphtheria', 'inflationary', 'racketeering', 'subjugation']","['supported by both sides', 'acute contagious infection caused by the bacterium Corynebacterium diphtheriae; marked by the formation of a false membrane in the throat and other air passages causing difficulty in breathing', 'associated with or tending to cause increases in inflation', 'engaging in a racket', 'forced submission to control by others']","['water', 'count', 'hand', 'bad', 'stop']","['binary compound that occurs at room temperature as a clear colorless odorless tasteless liquid; freezes into ice below 0 degrees centigrade and boils above 100 degrees centigrade; widely used as a solvent', 'the total number counted', 'the (prehensile) extremity of the superior limb', 'that which is below standard or expectations as of ethics or decency', 'the event of something ending']","Government aid
can only supplement the role of private investment, trade expansion,
commodity stabilization, and, above all, internal self-improvement.",9.065000000000000,But free world development will still be an uphill struggle.,"The
processes of growth are gradual--bearing fruit in a decade, not a day.","Well over a million more men and women
are working today than were working 2 years ago.",6.47,"At home, the recession is behind us.","The average factory
work week is once again more than 40 hours; our industries are turning out
more goods than ever before; and more than half of the manufacturing
capacity that lay silent and wasted 100 weeks ago is humming with
activity."
Thomas Jefferson,7.79649890957893,"['arraignment', 'efficacious', 'adjudication', 'solicitude', 'tenure']","['a legal document calling someone to court to answer an indictment', 'marked by qualities giving the power to produce an intended effect; -Aldous Huxley', 'the final judgment in a legal proceeding; the act of pronouncing judgment based on the evidence presented', 'a feeling of excessive concern', 'the term during which some position is held']","['water', 'count', 'happy', 'hand', 'ask']","['binary compound that occurs at room temperature as a clear colorless odorless tasteless liquid; freezes into ice below 0 degrees centigrade and boils above 100 degrees centigrade; widely used as a solvent', 'the total number counted', 'enjoying or showing or marked by joy or pleasure', 'the (prehensile) extremity of the superior limb', 'inquire about']","They will maintain the public interests while a more permanent force shall
be in course of preparation.",7.81875,"A steady, perhaps a quickened, pace in preparation for the defense
of our sea port towns and waters; an early settlement of the most exposed
and vulnerable parts of our country; a militia so organized that its
effective portions can be called to any point in the Union, or volunteers
instead of them to serve a sufficient time, are means which may always be
ready, yet never preying on our resources until actually called into use.","But much will depend on the promptitude with
which these means can be brought into activity.","Propositions for
adjusting amicably the boundaries of Louisiana have not been acceded to.",3.72,"On the Mobile, our commerce passing through that river continues to
be obstructed by arbitrary duties and vexatious searches.","While, however, the right is unsettled, we have avoided changing the state
of things by taking new posts or strengthening ourselves in the disputed
territories, in the hope that the other power would not by a contrary
conduct oblige us to meet their example and endanger conflicts of authority,
the issue of which may not be easily controlled."
Millard Fillmore,7.9782902428057500,"['condign', 'indemnity', 'peremptory', 'disembarkation', 'arbiter']","['fitting or appropriate and deserved; used especially of punishment', 'protection against future loss', 'offensively self-assured or given to exercising usually unwarranted power', 'the act of passengers and crew getting off of a ship or aircraft', 'someone with the power to settle matters at will']","['water', 'mother', 'happy', 'hand', 'ask']","['binary compound that occurs at room temperature as a clear colorless odorless tasteless liquid; freezes into ice below 0 degrees centigrade and boils above 100 degrees centigrade; widely used as a solvent', 'a woman who has given birth to a child (also used as a term of address to your mother)', 'enjoying or showing or marked by joy or pleasure', 'the (prehensile) extremity of the superior limb', 'inquire about']","You will consider whether further legislation
be necessary to prevent the perpetration of such offenses in future.",8.7775,"These originators of the invasion of Cuba seem to have
determined with coolness and system upon an undertaking which should
disgrace their country, violate its laws, and put to hazard the lives of
ill-informed and deluded men.","No individuals have a right to hazard the peace of the country or to
violate its laws upon vague notions of altering or reforming governments in
other states.","There were 1,698 post-offices established and 256
discontinued during the year.",5.24,"The whole number of post-offices in the United States on the 30th day of
June last was 19,796.","The gross revenues of the Department for the fiscal year, including the
appropriations for the franked matter of Congress, of the Departments, and
officers of Government, and excluding the foreign postages collected for
and payable to the British post-office, amounted to $6,727,866.78."
William Henry Harrison,7.903684786104860,"['obviate', 'remunerative', 'indemnity', 'adjudication', 'defalcation']","['do away with', 'for which money is paid', 'protection against future loss', 'the final judgment in a legal proceeding; the act of pronouncing judgment based on the evidence presented', 'the sum of money that is misappropriated']","['water', 'count', 'mother', 'happy', 'hand']","['binary compound that occurs at room temperature as a clear colorless odorless tasteless liquid; freezes into ice below 0 degrees centigrade and boils above 100 degrees centigrade; widely used as a solvent', 'the total number counted', 'a woman who has given birth to a child (also used as a term of address to your mother)', 'enjoying or showing or marked by joy or pleasure', 'the (prehensile) extremity of the superior limb']","Gratification
and amazement struggle for supremacy as we contemplate the population,
wealth, and moral strength of our country.",9.263,"The vista that
now opens to us is wider and more glorious than ever before.","A trust momentous in its
influence upon our people and upon the world is for a brief time committed
to us, and we must not be faithless to its first condition--the defense of
the free and equal influence of the people in the choice of public officers
and in the control of public affairs.",On the 16th day of April last I appointed Hon.,3.5,"The one
submitted to the Indians a specific proposition; the other (section 3 of
the Indian appropriation act) authorized the President to appoint three
commissioners to negotiate with these Indians for the accomplishment of the
same general purpose, and required that any agreements made should be
submitted to Congress for ratification.","Charles Foster, of Ohio,
Hon."
Gerald Ford,7.573696603459050,"['bipartisan', 'inflationary', 'ballistic', 'inequitable', 'immutable']","['supported by both sides', 'associated with or tending to cause increases in inflation', 'relating to or characteristic of the motion of objects moving under their own momentum and the force of gravity', 'not equitable or fair', 'not subject or susceptible to change or variation in form or quality or nature']","['count', 'mother', 'happy', 'hand', 'bad']","['the total number counted', 'a woman who has given birth to a child (also used as a term of address to your mother)', 'enjoying or showing or marked by joy or pleasure', 'the (prehensile) extremity of the superior limb', 'that which is below standard or expectations as of ethics or decency']","A necessary condition of a healthy economy is freedom from the petty
tyranny of massive government regulation.",9.421000000000000,"But with lower
interest rates and available mortgage money, we can have a healthy recovery
in 1976.","We are wasting literally millions
of working hours costing billions of taxpayers' and consumers' dollars
because of bureaucratic redtape.","We came from many roots, and we have many branches.",3.72,But think for a minute how far we have come in 200 years.,"Yet all Americans
across the eight generations that separate us from the stirring deeds of
1776, those who know no other homeland and those who just found refuge
among our shores, say in unison:

I am proud of America, and I am proud to be an American."
George Washington,8.098029836609050,"['condign', 'obviate', 'deputation', 'licentious', 'circumspection']","['fitting or appropriate and deserved; used especially of punishment', 'do away with', 'a group of representatives or delegates', 'lacking moral discipline; especially sexually unrestrained', 'knowing how to avoid embarrassment or distress']","['count', 'happy', 'hand', 'stop', 'see']","['the total number counted', 'enjoying or showing or marked by joy or pleasure', 'the (prehensile) extremity of the superior limb', 'the event of something ending', ""the seat within a bishop's diocese where his cathedral is located""]","Ought our country to remain in such cases dependent on foreign supply,
precarious because liable to be interrupted?",9.153333333333330,"As a general rule, manufactures on public account are
inexpedient; but where the state of things in a country leaves little hope
that certain branches of manufacture will for a great length of time
obtain, when these are of a nature essential to the furnishing and
equipping of the public force in time of war, are not establishments for
procuring them on public account to the extent of the ordinary demand for
the public service recommended by strong considerations of national policy
as an exception to the general rule?","If the necessary article
should in this mode cost more in time of peace, will not the security and
independence thence arising form an ample compensation?","Measures are in
operation for effecting treaties with the Regencies of Tunis and Tripoli.",7.84,"The actual liberation of all our citizens who were prisoners in
Algiers, while it gratifies every feeling of heart, is itself an earnest of
a satisfactory termination of the whole negotiation.","To an active external commerce the protection of a naval force is
indispensable."
Warren G. Harding,8.100142819359960,"['remunerative', 'amelioration', 'requisite', 'prostrate', 'bulwark']","['for which money is paid', 'the act of relieving ills and changing for the better', 'anything indispensable', 'get into a prostrate position, as in submission', 'an embankment built around a space for defensive purposes']","['water', 'count', 'hand', 'big', 'ask']","['binary compound that occurs at room temperature as a clear colorless odorless tasteless liquid; freezes into ice below 0 degrees centigrade and boils above 100 degrees centigrade; widely used as a solvent', 'the total number counted', 'the (prehensile) extremity of the superior limb', 'above average in size or number or quantity or magnitude or extent', 'inquire about']","Contemplating the inevitable and desirable increase of population, there is
another phase of reclamation full worthy of consideration.",9.435555555555560,"These prospects seem to afford every justification of
Government advances in reclamation and irrigation.","There are
79,000,000 acres of swamp and cut-over lands which may be reclaimed and
made as valuable as any farm lands we possess.","These
have proven very helpful to the cooperating communities in Europe.",4.58,"Every proper
encouragement should be given to the cooperative marketing programs.","In
Russia the cooperative community has become the recognized bulwark of law
and order, and saved individualism from engulfment in social paralysis."
Ulysses S. Grant,7.943165137614680,"['sagacity', 'mikado', 'remunerative', 'indemnity', 'contravene']","['the mental ability to understand and discriminate between relations', 'the emperor of Japan; when regarded as a religious leader the emperor is called tenno', 'for which money is paid', 'protection against future loss', 'go against, as of rules and laws']","['water', 'count', 'mother', 'happy', 'hand']","['binary compound that occurs at room temperature as a clear colorless odorless tasteless liquid; freezes into ice below 0 degrees centigrade and boils above 100 degrees centigrade; widely used as a solvent', 'the total number counted', 'a woman who has given birth to a child (also used as a term of address to your mother)', 'enjoying or showing or marked by joy or pleasure', 'the (prehensile) extremity of the superior limb']","Our progress has been great in all the arts--in science,
agriculture, commerce, navigation, mining, mechanics, law, medicine, etc.",8.822,"Our liberties remain unimpaired; the bondmen have been freed from slavery;
we have become possessed of the respect, if not the friendship, of all
civilized nations.",";
and in general education the progress is likewise encouraging.","In two of
said counties, York and Spartanburg, many arrests have been made.",3.72,"Direction was given that within the counties so designated persons
supposed, upon creditable information, to be members of such unlawful
combinations should be arrested by the military forces of the United States
and delivered to the marshal, to be dealt with according to law.","At the
last account the number of persons thus arrested was 168."
John Adams,8.132741858919590,"['obviate', 'indemnity', 'licentious', 'exchequer', 'sanguine']","['do away with', 'protection against future loss', 'lacking moral discipline; especially sexually unrestrained', 'the funds of a government or institution or individual', 'a blood-red color']","['mother', 'happy', 'hand', 'bed', 'door']","['a woman who has given birth to a child (also used as a term of address to your mother)', 'enjoying or showing or marked by joy or pleasure', 'the (prehensile) extremity of the superior limb', 'a piece of furniture that provides a place to sleep', 'a swinging or sliding barrier that will close the entrance to a room or building or vehicle']","They have full power to conclude a treaty, subject to the constitutional
advice and consent of the Senate.",8.209,"The assurances which were required of the French Government previous to the
departure of our envoys have been given through their minister of foreign
relations, and I have directed them to proceed on their mission to Paris.","The characters of these gentlemen are
sure pledges to their country that nothing incompatible with its honor or
interest, nothing inconsistent with our obligations of good faith or
friendship to any other nation, will be stipulated.","During
those wars treaties with Great Britain and Spain had been effected, and
those with Prussia and France renewed.",5.05,"Before the wars of the French Revolution such treaties had been
consummated with the United Netherlands, Sweden, and Prussia.","In all these some concessions to
the liberal principles of intercourse proposed by the United States had
been obtained; but as in all the negotiations they came occasionally in
collision with previous internal regulations or exclusive and excluding
compacts of monopoly with which the other parties had been trammeled,
the advances made in them toward the freedom of trade were partial and
imperfect."
Abraham Lincoln,7.803927686973750,"['obviate', 'remunerative', 'sanguine', 'adjudication', 'pasha']","['do away with', 'for which money is paid', 'a blood-red color', 'the final judgment in a legal proceeding; the act of pronouncing judgment based on the evidence presented', 'a civil or military authority in Turkey or Egypt']","['water', 'hand', 'bad', 'ask', 'door']","['binary compound that occurs at room temperature as a clear colorless odorless tasteless liquid; freezes into ice below 0 degrees centigrade and boils above 100 degrees centigrade; widely used as a solvent', 'the (prehensile) extremity of the superior limb', 'that which is below standard or expectations as of ethics or decency', 'inquire about', 'a swinging or sliding barrier that will close the entrance to a room or building or vehicle']","A proposition is pending to revive the
convention, that it may be able to do more complete justice.",8.441000000000000,"The
commission under the convention with the Republic of New Granada closed
its session without having audited and passed upon all the claims which
were submitted to it.","The joint
commission between the United States and the Republic of Costa Rica has
completed its labors and submitted its report.","Only 12 of them were soldiers, of whom 7 have since died.",3.72,"At the
beginning of the year the number of Revolutionary pensioners was 1,430.","The remainder
are those who under the law receive pensions because of relationship to
Revolutionary soldiers."
William McKinley,8.178186328267800,"['obviate', 'inculpate', 'indemnity', 'deleterious', 'peremptory']","['do away with', 'suggest that someone is guilty', 'protection against future loss', 'harmful to living things', 'offensively self-assured or given to exercising usually unwarranted power']","['water', 'mother', 'happy', 'hand', 'stop']","['binary compound that occurs at room temperature as a clear colorless odorless tasteless liquid; freezes into ice below 0 degrees centigrade and boils above 100 degrees centigrade; widely used as a solvent', 'a woman who has given birth to a child (also used as a term of address to your mother)', 'enjoying or showing or marked by joy or pleasure', 'the (prehensile) extremity of the superior limb', 'the event of something ending']","Most desirable from every standpoint of national interest and patriotism is
the effort to extend our foreign commerce.",9.622222222222220,"It is believed that
by a careful exercise of the powers conferred by that Act some grievances
of our own and of other countries in our mutual trade relations may be
either removed, or largely alleviated, and that the volume of our
commercial exchanges may be enlarged, with advantage to both contracting
parties.","To this end our merchant marine
should be improved and enlarged.","We are doing
these things with the means at hand.",2.74,"We are maintaining the parity of all
the money issued or coined by authority of the Government.","Happily at the present time we are not
compelled to resort to loans to supply gold."
Donald Trump,6.989892134831460,"['meth', 'counterterrorism', 'bipartisan', 'hake', 'tenure']","['an amphetamine derivative (trade name Methedrine) used in the form of a crystalline hydrochloride; used as a stimulant to the nervous system and as an appetite suppressant', 'a strategy intended to prevent or counter terrorism', 'supported by both sides', 'the lean flesh of a fish similar to cod', 'the term during which some position is held']","['mom', 'water', 'daddy', 'dad', 'mother']","['informal terms for a mother', 'binary compound that occurs at room temperature as a clear colorless odorless tasteless liquid; freezes into ice below 0 degrees centigrade and boils above 100 degrees centigrade; widely used as a solvent', 'an informal term for a father; probably derived from baby talk', 'an informal term for a father; probably derived from baby talk', 'a woman who has given birth to a child (also used as a term of address to your mother)']","We must choose between greatness or gridlock, results or resistance, vision or vengeance, incredible progress or pointless destruction.",8.092727272727270,The decision is ours to make.,"Tonight, I ask you to choose greatness.","But in September 2016, on the eve of Nisa's 16th Birthday,
neither of them came home.",2.85,"Their two teenage
daughters -- Kayla Cuevas and Nisa Mickens -- were close friends on Long
Island.","These two precious girls were brutally
murdered while walking together in their hometown."
James Buchanan,7.944884209263260,"['indemnity', 'deleterious', 'banditti', 'intemperate', 'arbiter']","['protection against future loss', 'harmful to living things', 'an armed thief who is (usually) a member of a band', '(of weather or climate) not mild; subject to extremes', 'someone with the power to settle matters at will']","['water', 'happy', 'hand', 'bad', 'animal']","['binary compound that occurs at room temperature as a clear colorless odorless tasteless liquid; freezes into ice below 0 degrees centigrade and boils above 100 degrees centigrade; widely used as a solvent', 'enjoying or showing or marked by joy or pleasure', 'the (prehensile) extremity of the superior limb', 'that which is below standard or expectations as of ethics or decency', 'a living organism characterized by voluntary movement']","But if in the
midst of the existing excitement the Union shall perish, the evil may then
become irreparable.",8.615000000000000,"I firmly
believe that it has reached and passed the culminating point.","Congress can contribute much to avert it by proposing and recommending to
the legislatures of the several States the remedy for existing evils which
the Constitution has itself provided for its own preservation.","It exists independently of all
constitutions, and has been exercised at all periods of the world's
history.",6.42,"The
right of resistance on the part of the governed against the oppression of
their governments can not be denied.","Under it old governments have been destroyed and new ones have
taken their place."
Dwight D. Eisenhower,7.929512663755460,"['repudiate', 'purport', 'bipartisan', 'inflationary', 'delineation']","['cast off', 'the intended meaning of a communication', 'supported by both sides', 'associated with or tending to cause increases in inflation', 'a graphic or vivid verbal description']","['water', 'count', 'happy', 'hand', 'eat']","['binary compound that occurs at room temperature as a clear colorless odorless tasteless liquid; freezes into ice below 0 degrees centigrade and boils above 100 degrees centigrade; widely used as a solvent', 'the total number counted', 'enjoying or showing or marked by joy or pleasure', 'the (prehensile) extremity of the superior limb', 'take in solid food']","Because drought also remains a serious agricultural problem, I shall
recommend legislation to strengthen Federal disaster assistance programs.",9.038181818181820,"I shall later
submit recommendations designed to assure the steady alleviation of their
most pressing concerns.","This legislation will prescribe an improved appraisal of need, better
adjustment of the various programs to local conditions, and a more
equitable sharing of costs between the States and the Federal Government.","We are also reducing further our requests for new
appropriations.",4.72,"This will
reduce the spending level over the two fiscal years by more than
$12,000,000,000.","Second, despite the substantial loss of revenue in the coming fiscal year,
resulting from tax reductions now in effect and tax adjustments which I
shall propose, our reduced spending will move the new budget closer to a
balance."
